iteration	score	total_return_pct	max_dd_pct	dd_violated	wr_violated	total_trades	win_rate	sharpe	pf	delta	status	description
218	0.14	0.24	40.36	False	False	126	41.27	2.1	0.6089	0.0	DISCARD	CONFIDENCE_LOW_MULT 0.3->0.5
219	0.14	0.24	40.36	False	False	126	41.27	2.1	0.6089	0.0	DISCARD	DAILY_RSI_OVERSOLD 35->45
220	0.14	0.24	40.36	False	False	126	41.27	2.1	0.6089	0.0	DISCARD	GARCH_VOL_INCREASE_SCALE 1.2->1.1
221	0.14	0.24	40.36	False	False	126	41.27	2.1	0.6089	0.0	DISCARD	CREDIT_WIDENING_SHORT_BOOST 0.0->0.15
222	0.14	0.24	40.36	False	False	126	41.27	2.1	0.6089	0.0	DISCARD	REGIME_NLP_WEIGHT 0.25->0.2
223	0.14	0.24	40.36	False	False	126	41.27	2.1	0.6089	0.0	DISCARD	BEAR_TRAILING_START_R 0.8->1.5
224	0.16	0.27	40.36	False	False	122	40.98	2.0877	0.6093	0.02	BELOW_THRESHOLD	RSI_FAST_PERIOD 3->7
225	-0.03	-0.06	47.32	False	False	139	36.69	2.3547	0.5366	-0.17	DISCARD	DAILY_RSI_WEIGHT 0.0->0.15
226	0.14	0.24	40.36	False	False	126	41.27	2.1	0.6089	0.0	DISCARD	SIDE_WEIGHT_SENTIMENT 0.1->0.05
227	0.12	0.2	40.37	False	False	127	40.94	2.161	0.6709	-0.02	DISCARD	BEAR_RSI_OVERSOLD 40->35
228	0.01	0.03	48.92	False	False	132	45.45	2.4837	0.7826	-0.13	DISCARD	BULL_DEFENSIVE_ENABLED True->False
229	-0.18	-0.28	36.42	False	False	170	40.59	2.2352	0.6785	-0.32	DISCARD	BULL_DEFENSIVE_THRESHOLD 0.5->0.3
230	0.14	0.24	40.36	False	False	126	41.27	2.1	0.6089	0.0	DISCARD	ADAPTIVE_TP_COUNTER_TREND_SCALE 1.0->0.7
231	0.0	-0.4	62.56	True	False	152	40.13	3.4579	0.481	-0.14	DISCARD	DXY_STRONG_THRESHOLD 110.0->105.0
232	0.14	0.24	40.36	False	False	126	41.27	2.1	0.6089	0.0	DISCARD	ADAPTIVE_TP_VIX_HIGH_SCALE 1.3->2.5
233	0.14	0.24	40.36	False	False	126	41.27	2.1	0.6089	0.0	DISCARD	GARCH_EXTREME_VOL_THRESHOLD 2.5->2.0
234	0.14	0.24	40.36	False	False	126	41.27	2.1	0.6089	0.0	DISCARD	MOMENTUM_EXIT_MIN_BARS 48->72
235	0.12	0.2	39.18	False	False	131	43.51	2.0059	0.5557	-0.02	DISCARD	BULL_RSI_OVERBOUGHT 80->65
236	0.14	0.24	40.36	False	False	126	41.27	2.1	0.6089	0.0	DISCARD	SIDE_WEIGHT_VIX 0.2->0.15
237	-0.87	-1.54	43.76	False	False	130	40.0	2.0818	0.621	-1.01	DISCARD	LIMIT_OFFSET_ATR 0.7->0.4
238	0.03	0.06	43.01	False	False	131	37.4	2.1854	0.5037	-0.11	DISCARD	BULL_STOP_ATR_MULT 3.5->2.5
239	0.14	0.24	40.36	False	False	126	41.27	2.1	0.6089	0.0	DISCARD	ADAPTIVE_TP_COUNTER_TREND_SCALE 1.0->0.6
240	0.03	0.05	31.26	False	False	134	38.81	2.1256	0.4702	-0.11	DISCARD	TSFRESH_SIGNAL_WEIGHT 0.0->0.1
241	0.14	0.24	40.36	False	False	126	41.27	2.1	0.6089	0.0	DISCARD	SIDE_RSI_OVERBOUGHT 60->70
242	0.14	0.24	40.36	False	False	126	41.27	2.1	0.6089	0.0	DISCARD	NLP_SENTIMENT_BOOST 0.15->0.25
243	0.12	0.2	40.36	False	False	125	43.2	2.0888	0.6474	-0.02	DISCARD	VOLUME_DRY_THRESHOLD 0.7->0.3
244	0.0	-0.23	66.34	True	False	131	42.75	3.0455	0.6816	-0.14	DISCARD	ADAPTIVE_COOLDOWN_ENABLED True->False
245	0.14	0.24	40.36	False	False	126	41.27	2.1	0.6089	0.0	DISCARD	SIDE_WEIGHT_MOMENTUM 0.2->0.25
246	-0.2	-0.39	48.33	False	False	161	39.13	2.4426	0.6366	-0.34	DISCARD	CREDIT_TIGHTENING_LONG_BOOST 0.0->0.05
247	0.14	0.24	40.36	False	False	126	41.27	2.1	0.6089	0.0	DISCARD	SIDE_TP_ATR_MULT 2.0->4.0
248	-0.33	-0.65	48.34	False	False	168	39.29	2.6603	0.6005	-0.47	DISCARD	BULL_WEIGHT_MOMENTUM 0.13->0.2
249	0.14	0.24	40.36	False	False	126	41.27	2.1	0.6089	0.0	DISCARD	VOL_HIGH_THRESHOLD_PCT 1.5->1.2
250	0.14	0.24	40.36	False	False	126	41.27	2.1	0.6089	0.0	DISCARD	VOL_EXTREME_SIZE_SCALE 0.5->0.25
251	0.0	0.0	0.0	False	True	0	0	0.0	0	-0.14	DISCARD	CUSUM_ENTRY_ENABLED False->True
252	0.14	0.24	40.36	False	False	126	41.27	2.1	0.6089	0.0	DISCARD	VOL_HIGH_SIZE_SCALE 0.5->0.6
253	0.0	-0.74	70.92	True	False	142	41.55	3.2973	0.5884	-0.14	DISCARD	BULL_STOP_ATR_MULT 3.5->1.5
254	0.14	0.24	40.36	False	False	126	41.27	2.1	0.6089	0.0	DISCARD	INTRADE_CREDIT_STRESS_TIGHTEN 0.5->1.0
255	0.14	0.24	40.36	False	False	126	41.27	2.1	0.6089	0.0	DISCARD	SEQ_MACRO_ADVERSE_SIZE_SCALE 1.0->0.4
256	0.1	0.17	40.37	False	False	132	40.15	2.1427	0.5444	-0.04	DISCARD	BEAR_WEIGHT_RSI 0.1->0.15
257	0.14	0.24	40.36	False	False	126	41.27	2.1	0.6089	0.0	DISCARD	MIN_ATR_THRESHOLD 5.0->4.0
258	0.14	0.24	40.36	False	False	126	41.27	2.1	0.6089	0.0	DISCARD	BREAKOUT_VOL_MULT 2.0->2.5
259	0.14	0.24	40.36	False	False	126	41.27	2.1	0.6089	0.0	DISCARD	VIX_TIER_4 35.0->30.0
260	0.13	0.23	40.5	False	False	125	41.6	2.1034	0.5949	-0.01	DISCARD	BEAR_TP_ATR_MULT 2.0->5.0
261	-1.32	-3.11	57.46	False	False	167	40.72	3.7139	0.7107	-1.46	DISCARD	BEAR_WEIGHT_MOMENTUM 0.1->0.3
262	0.14	0.24	40.36	False	False	126	41.27	2.1	0.6089	0.0	DISCARD	CTA_BUY_POTENTIAL_LONG_BOOST 0.0->0.1
263	-1.13	-1.89	40.41	False	False	133	42.11	2.0712	0.5757	-1.27	DISCARD	STOP_TIGHTEN_ATR_MULT 1.2->0.8
264	-0.88	-1.55	43.18	False	False	116	43.1	2.001	0.6531	-1.02	DISCARD	COPPER_FALLING_SHORT_BOOST 0.1->0.05
265	0.2	0.33	39.78	False	False	120	42.5	2.3204	0.6601	0.06	BELOW_THRESHOLD	BEAR_RSI_OVERSOLD 40->25
266	0.05	0.09	47.28	False	False	133	42.86	2.2959	0.7086	-0.09	DISCARD	BULL_WEIGHT_MOMENTUM 0.13->0.15
267	0.14	0.24	40.36	False	False	126	41.27	2.1	0.6089	0.0	DISCARD	RSI_FAST_OVERSOLD 30->15
268	0.16	0.27	39.78	False	False	125	41.6	2.0141	0.641	0.02	BELOW_THRESHOLD	VIX_OPPORTUNITY_LONG_BOOST 0.3->0.15
269	0.14	0.24	40.36	False	False	126	41.27	2.1	0.6089	0.0	DISCARD	NLP_SENTIMENT_BOOST 0.15->0.1
270	0.14	0.24	40.36	False	False	126	41.27	2.1	0.6089	0.0	DISCARD	BEAR_TRAILING_ATR_MULT 0.8->2.0
271	0.05	0.09	47.39	False	False	126	41.27	2.3405	0.6336	-0.09	DISCARD	SEQ_MACRO_FAVORABLE_SIZE_SCALE 1.2->1.5
272	0.14	0.24	40.36	False	False	126	41.27	2.1034	0.6096	0.0	DISCARD	BULL_DEFENSIVE_TP_ATR 3.0->5.0
273	0.26	0.39	33.63	False	False	110	39.09	2.1	0.5715	0.12	BELOW_THRESHOLD	RSI_PERIOD 10->18
274	0.16	0.31	47.97	False	False	119	37.82	2.2468	0.5811	0.02	BELOW_THRESHOLD	ATR_PERIOD 28->20
275	0.03	0.07	56.6	False	False	126	41.27	2.6173	0.6215	-0.11	DISCARD	BEAR_RISK_MULT 0.6->1.0
276	0.14	0.24	40.36	False	False	126	41.27	2.1	0.6089	0.0	DISCARD	VOL_HIGH_THRESHOLD_PCT 1.5->1.8
277	0.14	0.24	40.36	False	False	126	41.27	2.1	0.6089	0.0	DISCARD	GARCH_VOL_DECREASE_SCALE 0.85->0.7
278	0.25	0.37	31.25	False	False	117	41.03	2.0366	0.5912	0.11	BELOW_THRESHOLD	VIX_COMPLACENCY_SHORT_BOOST 0.05->0.0
279	0.11	0.19	39.89	False	False	119	41.18	2.3276	0.5373	-0.03	DISCARD	BEAR_RSI_OVERSOLD 40->20
280	0.43	0.61	29.96	False	False	119	40.34	1.6971	0.5698	0.29	KEEP	COOLDOWN_BARS 6->36
281	0.12	0.18	34.42	False	False	123	42.28	2.0237	0.7557	-0.31	DISCARD	REGIME_PARTICLE_WEIGHT 0.1->0.3
282	0.43	0.61	29.96	False	False	119	40.34	1.6971	0.5698	0.0	DISCARD	ADAPTIVE_TP_COUNTER_TREND_SCALE 1.0->0.6
283	-1.16	-1.59	27.38	False	False	132	38.64	1.4577	0.497	-1.59	DISCARD	BEAR_MAX_HOLD_BARS 432->72
284	0.43	0.61	29.96	False	False	119	40.34	1.6971	0.5698	0.0	DISCARD	SIDE_COMPOSITE_THRESHOLD 0.35->0.2
285	-1.47	-2.35	37.24	False	False	159	38.36	2.5129	0.586	-1.9	DISCARD	BEAR_WEIGHT_MOMENTUM 0.1->0.3
286	0.43	0.61	29.96	False	False	119	40.34	1.6971	0.5698	0.0	DISCARD	SIDE_WEIGHT_SENTIMENT 0.1->0.0
287	0.43	0.61	29.96	False	False	119	40.34	1.6971	0.5698	0.0	DISCARD	CUSUM_WINDOW_BARS 6->12
288	0.3	0.51	39.78	False	False	128	39.06	2.1496	0.4641	-0.13	DISCARD	DXY_STRONG_THRESHOLD 110.0->107.0
289	0.42	0.6	29.96	False	False	119	39.5	1.7005	0.5735	-0.01	DISCARD	BULL_DEFENSIVE_RISK_MULT 0.3->0.4
290	0.38	0.6	37.54	False	False	120	40.0	1.8828	0.5211	-0.05	DISCARD	RSI_FAST_OVERBOUGHT 80->65
291	0.44	0.64	31.1	False	False	119	40.34	1.7492	0.5622	0.01	BELOW_THRESHOLD	GARCH_ENABLED False->True
292	0.47	0.68	29.95	False	False	113	40.71	1.6691	0.5637	0.04	BELOW_THRESHOLD	BULL_WEIGHT_SENTIMENT 0.15->0.0
293	0.43	0.61	29.96	False	False	119	40.34	1.6971	0.5698	0.0	DISCARD	MIN_HOLD_BARS 24->6
294	0.43	0.61	29.96	False	False	119	40.34	1.6971	0.5698	0.0	DISCARD	REGIME_DIGEST_WEIGHT 0.05->0.15
295	0.43	0.61	29.96	False	False	119	40.34	1.6971	0.5698	0.0	DISCARD	BEAR_TRAILING_START_R 0.8->1.5
296	0.43	0.61	29.96	False	False	119	40.34	1.6971	0.5698	0.0	DISCARD	BEAR_MAX_HOLD_BARS 432->1152
297	0.43	0.61	29.96	False	False	119	40.34	1.6971	0.5698	0.0	DISCARD	SIDE_STOP_ATR_MULT 2.0->3.0
298	0.43	0.61	29.96	False	False	119	40.34	1.6971	0.5698	0.0	DISCARD	HY_OAS_NORMAL 350->250
299	0.42	0.6	29.96	False	False	124	44.35	1.698	0.6686	-0.01	DISCARD	BULL_RSI_OVERSOLD 30->40
300	0.26	0.38	30.44	False	False	125	41.6	1.8718	0.6135	-0.17	DISCARD	DXY_WEAK_LONG_BOOST 0.0->0.05
301	0.26	0.42	38.8	False	False	119	40.34	1.9406	0.5478	-0.17	DISCARD	BULL_RISK_MULT 0.4->0.6
302	-1.14	-1.91	40.05	False	False	140	37.14	2.3259	0.4045	-1.57	DISCARD	BEAR_WEIGHT_VIX 0.1->0.25
303	-0.5	-0.82	39.21	False	False	154	44.16	2.6771	0.8728	-0.93	DISCARD	REGIME_VIX_WEIGHT 0.0->0.3
304	0.43	0.61	29.96	False	False	119	40.34	1.6971	0.5698	0.0	DISCARD	BEAR_TRAILING_START_R 0.8->1.0
305	0.43	0.61	29.96	False	False	119	40.34	1.6971	0.5698	0.0	DISCARD	SIDE_TRAILING_START_R 0.5->1.0
306	0.43	0.61	29.96	False	False	119	40.34	1.6971	0.5698	0.0	DISCARD	NLP_SENTIMENT_BOOST 0.15->0.05
307	0.23	0.41	42.74	False	False	125	37.6	1.9656	0.5927	-0.2	DISCARD	BEAR_STOP_ATR_MULT 3.5->2.5
308	0.32	0.45	29.98	False	False	134	40.3	1.757	0.6246	-0.11	DISCARD	BULL_WEIGHT_RSI 0.12->0.2
309	0.43	0.61	29.96	False	False	119	40.34	1.6971	0.5698	0.0	DISCARD	ADAPTIVE_STOP_HIGH_VOL_SCALE 1.2->1.5
310	0.43	0.61	29.96	False	False	119	40.34	1.6971	0.5698	0.0	DISCARD	SENTIMENT_SIGNAL_WEIGHT 0.15->0.25
311	0.44	0.62	29.96	False	False	118	40.68	1.6924	0.5788	0.01	BELOW_THRESHOLD	DAILY_COUNTER_TREND_PENALTY 0.15->0.2
312	0.43	0.61	29.96	False	False	119	40.34	1.6971	0.5698	0.0	DISCARD	INTRADE_CREDIT_STRESS_TIGHTEN 0.5->1.0
313	0.45	0.65	29.96	False	False	118	41.53	1.7045	0.6011	0.02	BELOW_THRESHOLD	VOLUME_AVG_LOOKBACK 10->20
314	0.43	0.61	29.96	False	False	119	40.34	1.6771	0.5341	0.0	DISCARD	MIN_RR_RATIO 1.0->2.5
315	0.43	0.61	29.96	False	False	119	40.34	1.6971	0.5698	0.0	DISCARD	DXY_STRONG_SHORT_BOOST 0.15->0.05
316	0.43	0.61	29.96	False	False	119	40.34	1.6971	0.5698	0.0	DISCARD	MIN_HOLD_BARS 24->12
317	0.43	0.61	29.96	False	False	119	40.34	1.6971	0.5698	0.0	DISCARD	REGIME_SMA_CROSS_WEIGHT 0.3->0.7
318	0.43	0.61	29.96	False	False	119	40.34	1.6971	0.5698	0.0	DISCARD	NLP_SENTIMENT_BOOST 0.15->0.2
319	0.43	0.61	29.96	False	False	119	40.34	1.6971	0.5698	0.0	DISCARD	ADAPTIVE_TP_TREND_ALIGNED_SCALE 1.8->1.5
320	0.7	1.0	29.95	False	False	92	41.3	1.5201	0.6003	0.27	BELOW_THRESHOLD	VIX_NORMAL_LONG_BOOST 0.1->0.0
321	0.43	0.61	29.96	False	False	119	40.34	1.6971	0.5698	0.0	DISCARD	ADAPTIVE_TP_VIX_ELEVATED_SCALE 1.0->1.5
322	-0.07	-0.15	54.88	False	False	119	40.34	2.6503	0.5286	-0.5	DISCARD	BULL_RISK_MULT 0.4->1.0
323	0.43	0.61	29.96	False	False	119	40.34	1.6971	0.5698	0.0	DISCARD	INTRADE_RSI_EXTREME_TIGHTEN_ATR 0.3->0.7
324	0.43	0.61	29.96	False	False	119	40.34	1.6971	0.5698	0.0	DISCARD	INTRADE_VIX_SPIKE_TIGHTEN 0.4->0.7
325	-1.57	-3.43	54.26	False	False	236	36.86	3.6262	0.6021	-2.0	DISCARD	SMA_FAST 30->10
326	0.43	0.61	29.96	False	False	119	40.34	1.6971	0.5698	0.0	DISCARD	ADAPTIVE_TP_VIX_HIGH_SCALE 1.3->2.5
327	0.14	0.24	40.36	False	False	126	41.27	2.1	0.6089	-0.29	DISCARD	COOLDOWN_BARS 36->12
328	0.11	0.19	41.5	False	False	126	34.92	2.0271	0.6324	-0.32	DISCARD	ADAPTIVE_STOP_LOW_VOL_SCALE 1.0->0.6
329	0.23	0.36	37.59	False	False	133	40.6	2.0312	0.6057	-0.2	DISCARD	BULL_WEIGHT_VIX 0.1->0.2
330	0.52	0.74	29.94	False	False	119	39.5	1.5861	0.5904	0.09	BELOW_THRESHOLD	CONFIDENCE_HIGH_MULT 2.5->1.2
331	0.43	0.61	29.96	False	False	119	40.34	1.6971	0.5698	0.0	DISCARD	REGIME_SMA_CROSS_WEIGHT 0.3->0.6
332	0.43	0.61	29.96	False	False	119	40.34	1.6971	0.5698	0.0	DISCARD	SIDE_MAX_HOLD_BARS 72->864
333	0.43	0.61	29.96	False	False	119	40.34	1.6971	0.5698	0.0	DISCARD	SIDE_TRAILING_START_R 0.5->0.8
334	-0.82	-1.17	29.75	False	False	106	44.34	1.4841	0.735	-1.25	DISCARD	COPPER_FALLING_SHORT_BOOST 0.1->0.0
335	-0.69	-1.08	36.44	False	False	205	40.98	2.4644	0.7574	-1.12	DISCARD	CREDIT_TIGHTENING_LONG_BOOST 0.0->0.15
336	0.2	0.33	37.62	False	False	144	39.58	2.0587	0.5812	-0.23	DISCARD	DAILY_RSI_WEIGHT 0.0->0.2
337	-0.9	-1.29	29.96	False	False	114	41.23	1.6022	0.6218	-1.33	DISCARD	VOLUME_AVG_LOOKBACK 10->50
338	0.35	0.5	29.97	False	False	130	41.54	1.7217	0.6012	-0.08	DISCARD	BULL_WEIGHT_BB 0.05->0.2
339	0.44	0.63	29.96	False	False	118	40.68	1.6775	0.5879	0.01	BELOW_THRESHOLD	VIX_OPPORTUNITY_LONG_BOOST 0.3->0.2
340	0.47	0.67	29.95	False	False	114	39.47	1.6562	0.5762	0.04	BELOW_THRESHOLD	RSI_FAST_PERIOD 3->10
341	0.45	0.65	29.96	False	False	116	41.38	1.6647	0.6057	0.02	BELOW_THRESHOLD	VIX_OPPORTUNITY_LONG_BOOST 0.3->0.1
342	0.43	0.61	29.96	False	False	119	40.34	1.6971	0.5698	0.0	DISCARD	BULL_TRAILING_ATR_MULT 0.5->2.0
343	0.43	0.61	29.96	False	False	119	40.34	1.6971	0.5698	0.0	DISCARD	BULL_TRAILING_ATR_MULT 0.5->0.3
344	0.43	0.61	29.96	False	False	119	40.34	1.6971	0.5698	0.0	DISCARD	BEAR_WEIGHT_TREND 0.15->0.2
345	0.44	0.63	29.96	False	False	118	40.68	1.6936	0.5669	0.01	BELOW_THRESHOLD	DAILY_LOSS_CIRCUIT_PCT -1.0->-1.5
346	0.72	1.03	29.94	False	False	77	36.36	1.4711	0.4934	0.29	BELOW_THRESHOLD	BULL_COMPOSITE_THRESHOLD 0.35->0.5
347	0.43	0.61	29.96	False	False	119	40.34	1.6971	0.5698	0.0	DISCARD	BEAR_MAX_HOLD_BARS 432->576
348	0.43	0.61	29.96	False	False	119	40.34	1.6971	0.5698	0.0	DISCARD	REGIME_PARTICLE_WEIGHT 0.1->0.05
349	0.4	0.57	29.96	False	False	122	40.98	1.705	0.5691	-0.03	DISCARD	BULL_WEIGHT_BB 0.05->0.1
350	0.45	0.64	29.95	False	False	118	40.68	1.6628	0.5487	0.02	BELOW_THRESHOLD	BEAR_TP_ATR_MULT 2.0->8.0
351	0.43	0.61	29.96	False	False	119	41.18	1.7005	0.5936	0.0	DISCARD	VOLUME_DRY_THRESHOLD 0.7->0.6
352	0.43	0.61	29.96	False	False	119	40.34	1.6971	0.5698	0.0	DISCARD	ADAPTIVE_TP_COUNTER_TREND_SCALE 1.0->0.8
353	0.46	0.66	29.95	False	False	117	39.32	1.6489	0.6082	0.03	BELOW_THRESHOLD	BB_STD 1.5->2.2
354	0.43	0.61	29.96	False	False	119	40.34	1.6971	0.5698	0.0	DISCARD	NLP_SENTIMENT_BOOST 0.15->0.1
355	-2.1	-3.1	32.25	False	False	188	40.96	2.5912	0.6689	-2.53	DISCARD	DAILY_TREND_BOOST 0.05->0.25
356	0.43	0.61	29.96	False	False	119	40.34	1.6971	0.5698	0.0	DISCARD	VOL_EXTREME_SIZE_SCALE 0.5->0.25
357	0.52	0.75	29.94	False	False	119	39.5	1.5864	0.5901	0.09	BELOW_THRESHOLD	CONFIDENCE_HIGH_THRESHOLD 0.5->0.6
358	0.43	0.61	29.96	False	False	119	40.34	1.6971	0.5698	0.0	DISCARD	SIDE_RISK_MULT 0.5->0.4
359	0.43	0.61	29.96	False	False	119	40.34	1.6971	0.5698	0.0	DISCARD	BREAKOUT_ENTRY_ENABLED True->False
360	0.41	0.59	29.97	False	False	121	39.67	1.7272	0.536	-0.02	DISCARD	BEAR_RSI_OVERBOUGHT 75->65
361	0.3	0.43	29.98	False	False	136	38.24	1.7952	0.5652	-0.13	DISCARD	DAILY_ATR_VOL_ADJUST 0.05->0.08
362	0.02	0.04	36.39	False	False	128	42.97	2.1234	0.7317	-0.41	DISCARD	REGIME_PRICE_VS_200_WEIGHT 0.5->0.3
363	0.43	0.61	29.96	False	False	119	40.34	1.6971	0.5698	0.0	DISCARD	SEQ_MACRO_REJECT_THRESHOLD -0.4->-0.5
364	-0.97	-1.78	45.64	False	False	157	38.22	2.3042	0.5155	-1.4	DISCARD	BEAR_COMPOSITE_THRESHOLD 0.4->0.25
365	0.43	0.61	29.96	False	False	119	40.34	1.6971	0.5698	0.0	DISCARD	RISKOFF_STOP_TIGHTEN_MULT 0.8->1.0
366	0.43	0.61	29.96	False	False	119	40.34	1.6971	0.5698	0.0	DISCARD	GARCH_VOL_DECREASE_SCALE 0.85->0.7
367	0.32	0.51	37.56	False	False	126	38.1	1.9539	0.5055	-0.11	DISCARD	BULL_WEIGHT_VIX 0.1->0.15
368	0.43	0.61	29.96	False	False	119	40.34	1.6971	0.5698	0.0	DISCARD	ADAPTIVE_STOP_VIX_PANIC_SCALE 0.7->0.8
369	-1.55	-3.06	49.25	False	False	227	38.77	3.7554	0.6376	-1.98	DISCARD	SMA_SLOW 30->50
370	0.47	0.65	27.31	False	False	111	39.64	1.8984	0.591	0.04	BELOW_THRESHOLD	BEAR_RSI_OVERSOLD 40->25
371	0.43	0.61	29.96	False	False	119	40.34	1.6971	0.5698	0.0	DISCARD	RIP_SELL_RSI_THRESHOLD 65->70
372	0.43	0.61	29.96	False	False	119	40.34	1.6971	0.5698	0.0	DISCARD	SIDE_TRAILING_START_R 0.5->2.0
373	0.12	0.2	41.05	False	False	119	40.34	2.1312	0.5532	-0.31	DISCARD	BULL_RISK_MULT 0.4->0.8
374	0.43	0.61	29.96	False	False	119	40.34	1.6971	0.5698	0.0	DISCARD	BULL_DEFENSIVE_TP_ATR 3.0->2.0
375	0.43	0.61	29.96	False	False	119	40.34	1.6971	0.5698	0.0	DISCARD	MOMENTUM_RSI_EXTREME 75->70
376	0.05	0.08	37.69	False	False	156	39.1	2.0619	0.5507	-0.38	DISCARD	BULL_WEIGHT_MOMENTUM 0.13->0.2
377	0.54	0.8	33.09	False	False	103	41.75	1.7828	0.94	0.11	BELOW_THRESHOLD	RSI_PERIOD 10->21
378	0.43	0.61	29.96	False	False	119	40.34	1.6971	0.5698	0.0	DISCARD	DXY_STRONG_SHORT_BOOST 0.15->0.0
379	0.42	0.61	30.73	False	False	112	39.29	1.8497	0.56	-0.01	DISCARD	STOP_TIGHTEN_ATR_MULT 1.2->2.0
380	0.37	0.52	29.98	False	False	126	38.89	1.7954	0.5258	-0.06	DISCARD	BB_PERIOD 25->10
381	0.52	0.72	27.29	False	False	109	41.28	1.7918	0.6647	0.09	BELOW_THRESHOLD	RSI_PERIOD 10->14
382	0.28	0.41	29.99	False	False	139	41.73	1.7742	0.6399	-0.15	DISCARD	BULL_WEIGHT_RSI 0.12->0.25
383	0.34	0.55	37.55	False	False	124	37.1	1.8838	0.4954	-0.09	DISCARD	DAILY_RSI_WEIGHT 0.0->0.1
384	0.01	0.01	29.96	False	False	120	39.17	1.7541	0.6171	-0.42	DISCARD	VIX_TIER_3 22.0->25.0
385	-0.02	-0.03	29.97	False	False	119	38.66	1.7935	0.624	-0.45	DISCARD	BEAR_WEIGHT_SENTIMENT 0.0->0.2
386	0.43	0.61	29.96	False	False	119	40.34	1.6971	0.5698	0.0	DISCARD	VOL_HIGH_SIZE_SCALE 0.5->0.6
387	0.43	0.61	29.96	False	False	119	40.34	1.6971	0.5698	0.0	DISCARD	GARCH_VOL_INCREASE_SCALE 1.2->1.4
388	0.43	0.61	29.96	False	False	119	40.34	1.6971	0.5698	0.0	DISCARD	ADAPTIVE_TP_FLOOR_ATR 3.0->10.0
389	0.43	0.61	29.96	False	False	119	40.34	1.6971	0.5698	0.0	DISCARD	RISKOFF_STOP_TIGHTEN_MULT 0.8->0.5
390	0.43	0.61	29.96	False	False	119	40.34	1.6971	0.5698	0.0	DISCARD	BREAKOUT_LOOKBACK 48->24
391	0.3	0.43	29.98	False	False	128	43.75	1.8423	0.6814	-0.13	DISCARD	ADAPTIVE_COOLDOWN_ENABLED True->False
392	0.45	0.64	29.97	False	False	117	40.17	1.7208	0.5948	0.02	BELOW_THRESHOLD	BEAR_RSI_OVERBOUGHT 75->60
393	0.43	0.61	29.96	False	False	119	40.34	1.6971	0.5698	0.0	DISCARD	RIP_SELL_RSI_THRESHOLD 65->60
394	0.15	0.28	45.65	False	False	133	35.34	2.2918	0.4041	-0.28	DISCARD	BEAR_WEIGHT_RSI 0.1->0.35
395	0.43	0.61	29.96	False	False	119	40.34	1.6971	0.5698	0.0	DISCARD	INTRADE_CREDIT_STRESS_TIGHTEN 0.5->0.6
396	0.43	0.61	29.96	False	False	119	40.34	1.6971	0.5698	0.0	DISCARD	MOMENTUM_RSI_EXTREME 75->85
397	0.32	0.51	37.23	False	False	124	39.52	1.8118	0.5902	-0.11	DISCARD	DAILY_LOSS_CIRCUIT_PCT -1.0->-5.0
398	0.42	0.6	29.96	False	False	120	40.0	1.698	0.5645	-0.01	DISCARD	DAILY_COUNTER_TREND_PENALTY 0.15->0.1
399	0.43	0.61	29.96	False	False	119	40.34	1.6971	0.5698	0.0	DISCARD	SIDE_RISK_MULT 0.5->0.6
400	0.36	0.51	29.97	False	False	119	39.5	1.7545	0.5447	-0.07	DISCARD	BULL_DEFENSIVE_RISK_MULT 0.3->0.6
401	0.43	0.61	29.96	False	False	119	40.34	1.6971	0.5698	0.0	DISCARD	SIDE_TP_ATR_MULT 2.0->7.0
402	0.24	0.38	36.18	False	False	128	45.31	2.0187	0.767	-0.19	DISCARD	BULL_DEFENSIVE_ENABLED True->False
403	0.43	0.61	29.96	False	False	119	40.34	1.6971	0.5698	0.0	DISCARD	ADAPTIVE_TP_TREND_ALIGNED_SCALE 1.8->2.0
404	0.44	0.63	29.96	False	False	118	39.83	1.6946	0.5677	0.01	BELOW_THRESHOLD	BEAR_RSI_OVERBOUGHT 75->80
405	0.43	0.61	29.96	False	False	119	40.34	1.6971	0.5698	0.0	DISCARD	MIN_ATR_THRESHOLD 5.0->1.5
406	-0.29	-0.41	30.72	False	False	170	40.59	2.1296	0.7067	-0.72	DISCARD	BULL_WEIGHT_MACRO 0.05->0.25
407	0.43	0.61	29.96	False	False	119	40.34	1.6971	0.5698	0.0	DISCARD	DAILY_RSI_OVERBOUGHT 70->55
408	0.43	0.6	27.3	False	False	118	42.37	1.8105	0.6402	0.0	DISCARD	BEAR_RSI_OVERSOLD 40->30
409	0.43	0.61	29.96	False	False	119	40.34	1.6971	0.5698	0.0	DISCARD	BREAKEVEN_R 1.5->1.0
410	0.43	0.61	29.96	False	False	119	40.34	1.6971	0.5698	0.0	DISCARD	DXY_WEAK_THRESHOLD 102.0->95.0
411	0.43	0.61	29.96	False	False	119	40.34	1.7005	0.5644	0.0	DISCARD	ADAPTIVE_TP_VOLUME_SURGE_SCALE 1.0->2.0
412	0.33	0.48	30.32	False	False	125	44.0	1.8408	0.6714	-0.1	DISCARD	SEQ_VOLUME_MIN_RATIO 0.7->0.1
413	0.4	0.57	29.96	False	False	120	39.17	1.7017	0.5769	-0.03	DISCARD	BULL_STOP_ATR_MULT 3.5->3.0
414	0.33	0.5	34.05	False	False	120	35.83	1.8058	0.4529	-0.1	DISCARD	ADAPTIVE_STOP_LOW_VOL_SCALE 1.0->0.8
415	0.43	0.61	29.96	False	False	119	40.34	1.6971	0.5698	0.0	DISCARD	INTRADE_VIX_SPIKE_TIGHTEN 0.4->1.0
416	0.3	0.43	30.41	False	False	127	40.94	1.8135	0.6452	-0.13	DISCARD	BULL_WEIGHT_MACRO 0.05->0.1
417	-0.88	-1.29	31.24	False	False	126	39.68	1.7066	0.5624	-1.31	DISCARD	USE_LIMIT_ORDERS True->False
418	0.47	0.68	30.71	False	False	110	40.91	1.6667	0.6019	0.04	BELOW_THRESHOLD	BEAR_WEIGHT_VIX 0.1->0.05
419	0.43	0.61	29.96	False	False	119	40.34	1.6992	0.5744	0.0	DISCARD	BULL_DEFENSIVE_TP_ATR 3.0->4.0
420	0.44	0.63	29.95	False	False	117	39.32	1.7034	0.5425	0.01	BELOW_THRESHOLD	BULL_RSI_OVERSOLD 30->20
421	0.44	0.62	29.96	False	False	121	41.32	1.6854	0.6298	0.01	BELOW_THRESHOLD	BULL_TRAILING_START_R 1.5->0.5
422	0.43	0.61	29.96	False	False	119	40.34	1.6971	0.5698	0.0	DISCARD	ADAPTIVE_TP_RSI_EXTENDED_SCALE 0.9->0.6
423	0.43	0.61	29.96	False	False	119	40.34	1.6971	0.5698	0.0	DISCARD	RSI_FAST_OVERSOLD 30->25
424	0.44	0.63	29.96	False	False	118	39.83	1.6741	0.5756	0.01	BELOW_THRESHOLD	BULL_RSI_OVERSOLD 30->25
425	0.43	0.61	29.96	False	False	119	40.34	1.6971	0.5698	0.0	DISCARD	SIDE_RISK_MULT 0.5->1.5
426	0.12	0.18	34.42	False	False	123	42.28	2.0237	0.7557	-0.31	DISCARD	REGIME_PARTICLE_WEIGHT 0.1->0.2
427	0.2	0.43	54.74	False	False	119	40.34	2.3911	0.5458	-0.23	DISCARD	BEAR_RISK_MULT 0.6->1.2
428	0.43	0.61	29.96	False	False	119	40.34	1.6971	0.5698	0.0	DISCARD	SIDE_COMPOSITE_THRESHOLD 0.35->0.25
429	0.43	0.61	29.96	False	False	119	40.34	1.6971	0.5698	0.0	DISCARD	SIDE_TRAILING_START_R 0.5->1.5
430	0.02	0.02	29.96	False	False	117	38.46	1.6541	0.5457	-0.41	DISCARD	BEAR_WEIGHT_SENTIMENT 0.0->0.1
431	0.0	-0.85	62.22	True	False	131	37.4	2.7918	0.4396	-0.43	DISCARD	BULL_STOP_ATR_MULT 3.5->1.0
432	0.43	0.61	29.96	False	False	119	40.34	1.6971	0.5698	0.0	DISCARD	BEAR_TRAILING_ATR_MULT 0.8->1.2
433	0.43	0.61	29.96	False	False	119	40.34	1.6971	0.5698	0.0	DISCARD	GARCH_EXTREME_VOL_THRESHOLD 2.5->1.5
434	0.43	0.61	29.96	False	False	119	40.34	1.6971	0.5698	0.0	DISCARD	REGIME_NLP_WEIGHT 0.25->0.1
435	0.21	0.33	38.34	False	False	133	39.1	2.2161	0.5656	-0.22	DISCARD	VIX_COMPLACENCY_SHORT_BOOST 0.05->0.15
436	0.52	0.75	29.94	False	False	119	39.5	1.5864	0.5901	0.09	BELOW_THRESHOLD	CONFIDENCE_HIGH_MULT 2.5->1.0
